{
  "custID": "N5509",
  "wholesalerID": "857309",
  "name": "Jen's Cantina",
  "deliveryWindows": [
    {
      "deliveryWindowID": "1",
      "startDate": "2014-10-10 20:00:00",
      "endDate": "2014-10-11 00:00:00"
    }
  ],
  "orderDeadlines": [
    {
      "day": 0,
      "time": "13:30:00"
    },
    {
      "day": 1,
      "time": "16:00:00"
    },
    {
      "day": 2,
      "time": "16:00:00"
    },
    {
      "day": 3,
      "time": "16:30:00"
    },
    {
      "day": 4,
      "time": "16:00:00"
    },
    {
      "day": 5,
      "time": "16:00:00"
    },
    {
      "day": 6,
      "time": "13:00:00"
    }
  ],
  "representatives": [
    {
      "representativeID": "23",
      "name": "RJ",
      "email": "rj@fuzzproductions.com",
      "phone": "212-646-9000"
    }
  ],
  "administrators": [
    {
      "userID": "FUZZ-158",
      "email": "noah@fuzzproductions.com",
      "name": "Noah Blake",
      "phone": "212-646-8000"
    }
  ],
  "users": [
    {
      "userID": "FUZZ-159",
      "email": "rj@fuzzproductions.com",
      "name": "RJStidd",
      "phone": "212-646-8000"
    }
  ]
}